,ID,title,abstract,authors,date,category,doi,version,author_corresponding,author_corresponding_institution,link_page,link_pdf,license,published,include
91,65413,Region-specific blood-brain barrier transporter changes leads to increased sensitivity to amisulpride in Alzheimer’s disease,"Research into amisulpride use in Alzheimers disease (AD) implicates blood-brain barrier (BBB) dysfunction in antipsychotic sensitivity. Solute carrier function in AD has not been widely studied. This study tests the hypothesis that organic cation transporters contribute to the BBB delivery of antipsychotics and is disrupted in AD.\n\nIn vitro BBB studies indicated that [3H]amisulpride and [3H]haloperidol were transported by OCT1. Amisulpride also utilized PMAT. Molecular docking predicted that amisulpride and haloperidol are OCT1, PMAT and MATE1 substrates, and amisulpride is not a P-gp substrate. Amisulpride brain uptake increased in 3xTgAD compared to wildtype mice. PMAT and MATE1 expression was reduced in brain from AD patients compared to controls. The increased sensitivity of Alzheimers patients to amisulpride is related to previously unreported changes in OCT1, PMAT and MATE1 function/expression at the BBB. Dose adjustments may be required for drugs that are substrates of these transporters when prescribing for AD patients.","Sekhar, G. N.; Fleckney, A. L.; Boyanova, S. T.; Rupawala, H.; Lo, R.; Wang, H.; Farag, D. B.; Rahman, K. M.; Broadstock, M.; Reeves, S.; Thomas, S. A.",20/03/2019,Neuroscience,10.1101/582387,1,Sarah Ann Thomas,King's College London,https://www.biorxiv.org/content/10.1101/582387v1?versioned=TRUE,https://www.biorxiv.org/content/10.1101/582387v1.full.pdf,cc_by,10.1186/s12987-019-0158-1,
92,65640,Beta secretase 1-dependent amyloid precursor protein processing promotes excessive vascular sprouting through NOTCH3 signaling,"Amyloid beta peptides (A{beta}) proteins play a key role in vascular pathology in Alzheimers Disease (AD) including impairment of the blood brain barrier and aberrant angiogenesis. Although previous work has demonstrated a pro-angiogenic role of A{beta}, the exact mechanisms by which amyloid precursor protein (APP) processing and endothelial angiogenic signalling cascades interact in AD remain a largely unsolved problem. Here, we report that increased endothelial sprouting in human-APP transgenic mouse (TgCRND8) tissue is dependent on {beta}-secretase (BACE1) processing of APP. Higher levels of A{beta} processing in TgCRND8 tissue coincides with decreased NOTCH3/JAG1 signalling, over-production of endothelial filopodia and increased numbers of vascular pericytes. Using a novel in vitro approach to study sprouting angiogenesis in TgCRND8 organotypic brain slice cultures (OBSCs), we find that BACE1 inhibition normalises excessive endothelial filopodia formation and restores NOTCH3 signalling. These data present the first evidence for the potential of BACE1 inhibition as an effective therapeutic target for aberrant angiogenesis in AD.\n\nSignificanceIn this study, we show that targeting amyloid beta processing provides an opportunity to selectively target tip cell filopodia-driven angiogenesis and develop therapeutic targets for vascular dysfunction related to aberrant angiogenesis in AD. Our data provide the first evidence for a safe level of BACE1 inhibition that can normalize excess angiogenesis in AD, without inducing vascular deficits in healthy tissue. Our findings may pave the way for the development of new angiogenesis dependent therapeutic strategies in Alzheimers Disease.","Durrant, C. S.; Ruscher, K.; Sheppard, O.; Coleman, M. P.; O¨zen, I.",21/03/2019,Neuroscience,10.1101/585489,1,Michael P Coleman,"Department of Clinical Neurosciences, University of Cambridge",https://www.biorxiv.org/content/10.1101/585489v1?versioned=TRUE,https://www.biorxiv.org/content/10.1101/585489v1.full.pdf,cc_by_nc_nd,10.1038/s41419-020-2288-4,
93,65748,Lipid membranes trigger misfolding and self-assembly of amyloid ß 42 protein into aggregates,"The assembly of polypeptides and proteins into nanoscale aggregates is a phenomenon observed in a vast majority of proteins. Importantly, aggregation of amyloid {beta} (A{beta}) proteins is considered as a major cause for the development of Alzheimers disease. The process depends on various conditions and typical test-tube experiments require high protein concentration that complicates the translation of results obtained in vitro to understanding the aggregation process in vivo. Here we demonstrate that A{beta}42 monomers at the membrane bilayer are capable of self-assembling into aggregates at physiologically low concentrations, and the membrane in this aggregation process plays a role of a catalyst. We applied all-atom molecular dynamics to demonstrate that the interaction with the membrane surface dramatically changes the conformation of A{beta}42 protein. As a result, the misfolded A{beta}42 rapidly assembles into dimers, trimers and tetramers, so the on-surface aggregation is the mechanism by which amyloid oligomers are produced and spread.","Banerjee, S.; Hashemi, M.; Zagorski, K.; Lyubchenko, Y.",23/03/2019,Neuroscience,10.1101/587493,1,Yuri Lyubchenko,University of Nebraska Medical Center,https://www.biorxiv.org/content/10.1101/587493v1?versioned=TRUE,https://www.biorxiv.org/content/10.1101/587493v1.full.pdf,cc_no,10.3390/ijms21031129,
94,66368,TET2 regulates the neuroinflammatory response in microglia,"Epigenetic mechanisms regulate distinct aspects of the inflammatory response in various immune cell types. Despite the central role for microglia, the resident macrophages of the brain, in neuroinflammation and neurodegeneration little is known about their epigenetic regulation of the inflammatory response. Here, we show that Ten-eleven translocation 2 (TET2) methylcytosine dioxygenase expression is increased in microglia upon stimulation with various inflammogens through a NF-{kappa}B-dependent pathway. We found that TET2 regulates early gene transcriptional changes that lead to early metabolic alterations, as well as a later inflammatory response independently of its 5mC oxidation activity at the affected genes. We further show that TET2 regulates the proinflammatory response in microglia induced by intraperitoneal injection of LPS in vivo. We observed that microglia associated to amyloid {beta} plaques, recently defined as disease-associated microglia, expressed TET2 in brain tissue from individuals with Alzheimers disease (AD) and in 5xFAD mice. Collectively, our findings show that TET2 plays an important role in the microglial inflammatory response, and suggest TET2 as a potential target to combat neurodegenerative brain disorders.","Carrillo-Jimenez, A.; Deniz, O.; Niklison-Chirou, M.; Ruiz-Laza, R.; Salomao, K.; Stratoulias, V.; Amoroux, R.; Yip, P.; Vilalta, A.; Cheray, M.; Scott-Egerton, A. M.; Rivas, E.; Tayara, K.; Garcia-Dominguez, I.; Garcia-Revilla, J.; Fernandez-Martin, J. C.; Espinosa-Oliva, A. M.; Shen, X.; Stgeorge-Hyslop, P.; Brown, G.; Hajkova, P.; Joseph, B.; Venero, J. L.; Branco, M. R.; Burguillos, M. A.",28/03/2019,Neuroscience,10.1101/592055,1,Miguel Angel Burguillos,Universidad de Sevilla,https://www.biorxiv.org/content/10.1101/592055v1?versioned=TRUE,https://www.biorxiv.org/content/10.1101/592055v1.full.pdf,cc_by_nc_nd,10.1016/j.celrep.2019.09.013,
95,67364,Impaired speed encoding is associated with reduced grid cell periodicity in a mouse model of tauopathy,"Dementia is associated with severe spatial memory deficits which arise from dysfunction in hippocampal and parahippocampal circuits. For spatially-sensitive neurons, such as grid cells, to faithfully represent the environment these circuits require precise encoding of direction and velocity information. Here we have probed the firing rate coding properties of neurons in medial entorhinal cortex (MEC) in a mouse model of tauopathy. We find that grid cell firing patterns are largely absent in rTg4510 mice, while head direction tuning remains largely intact. Conversely, neural representation of running speed information was significantly disturbed, with smaller proportions of MEC cells having firing rates correlated with locomotion in rTg4510 mice. Additionally, the power of local field potential oscillations in the theta and gamma frequency bands, which in wildtype mice are tightly linked to running speed, was invariant in rTg4510 mice. These deficits in locomotor speed encoding likely severely impact path integration systems in dementia.","Ridler, T.; Witton, J.; Phillips, K. G.; Randall, A. D.; Brown, J. T.",09/04/2019,Neuroscience,10.1101/595652,1,Jonathan T Brown,University of Exeter,https://www.biorxiv.org/content/10.1101/595652v1?versioned=TRUE,https://www.biorxiv.org/content/10.1101/595652v1.full.pdf,cc_by_nc_nd,10.7554/eLife.59045,
96,66811,Early Hippocampal Sharp-Wave Ripple Deficits Predict Later Learning and Memory Impairments in an Alzheimer’s Disease Mouse Model,"Alzheimers disease (AD) is characterized by progressive memory loss, and there is a pressing need to identify early pathophysiological alterations that predict subsequent memory impairment. Hippocampal sharp-wave ripples (SWRs) - electrophysiological signatures of memory reactivation in the hippocampus - are a compelling candidate for doing so. Mouse models of AD show reductions in both SWR abundance and associated slow gamma (SG) power during aging, but these alterations have yet to be directly linked to memory impairments. In aged apolipoprotein E4 knock in (apoE4-KI) mice - a model of the major genetic risk factor for AD - we found that reduced SWR abundance and associated CA3 SG power predicted spatial memory impairments measured 1-2 months later. Importantly, SWR-associated CA3 SG power reduction in young apoE4-KI mice also predicted spatial memory deficits measured 10 months later. These results establish features of SWRs as potential functional biomarkers of memory impairment in AD.","Jones, E. A.; Gillespie, A. K.; Yoon, S. Y.; Frank, L. M.; Huang, Y.",02/04/2019,Neuroscience,10.1101/596569,1,Yadong Huang,"Gladstone Institutes & University of California, San Francisco",https://www.biorxiv.org/content/10.1101/596569v1?versioned=TRUE,https://www.biorxiv.org/content/10.1101/596569v1.full.pdf,cc_by,10.1016/j.celrep.2019.10.056,
97,67043,Cognitive Improvements after Intermittent Deep Brain Stimulation of the Nucleus Basalis of Meynert in a Transgenic Rat Model for Alzheimer’s disease; a Preliminary Approach,"BackgroundDeep brain stimulation (DBS) of the nucleus basalis of Meynert (NBM) has shown to have promising results in a pilot study with patients suffering from Alzheimers disease (AD). A recent study in aged monkeys shows a novel intermittent stimulation pattern to have superior cognitive benefits over continuous paradigms.\n\nObjective/HypothesisWe aimed at comparing the cognitive effects elicited by intermittent and continuous NBM stimulation paradigms in an animal model for AD (TgF344-AD rat line; TG), i.e. rats expressing mutant human amyloid precursor protein (APPsw) and presenilin 1 (PS1{Delta}E9) genes, each independent causes of early-onset familial AD.\n\nMethodsIn this exploratory study, aged APP/PS1 rats were tested pre-, and post implantation with several stimulation parameters, i.e. unilateral- or bilateral-intermittent, and bilateral-continuous, while performing various behavioral tasks (open field, novel object recognition, and modified Barnes maze).\n\nResults and ConclusionBilateral-intermittent NBM DBS allowed aged TG rats to perform better and maintain their performance longer in a spatial memory task, as compared to other conditions. These data support the notion that NBM DBS could be further refined in the clinic, thereby improving patient care.","Koulousakis, P.; Van Den Hove, D.; Visser-Vandewalle, V.; Sesia, T.",05/04/2019,Neuroscience,10.1101/600296,1,Philippos Koulousakis,University Hospital Clinic of Cologne,https://www.biorxiv.org/content/10.1101/600296v1?versioned=TRUE,https://www.biorxiv.org/content/10.1101/600296v1.full.pdf,cc_by_nc_nd,10.3233/JAD-190919,
98,68315,Sex-dependent polygenic effects on the clinical progressions of Alzheimer’s disease,"Sex differences in the manifestations of Alzheimers disease (AD) are under intense investigations 1,2. Despite the emerging importance of polygenic predictions for AD 3-8, the sex-dependent polygenic effects have not been demonstrated. Here, using a sex crossover analysis, we show that sex-dependent autosomal genetic effects on AD can be revealed by characterizing disease progress via the hazard function. We first performed sex-stratified genome-wide associations, and then applied derived sex-dependent weights to two independent cohorts. Sex-matched polygenic hazard scores (PHS) have significantly stronger associations with age-at-disease-onset, clinical progressions, amyloid depositions, neurofibrillary tangles, and composite neuropathological scores, than sex-mismatched PHS, independent of apolipoprotein E. Models without using hazard weights, i.e. polygenic risk scores (PRS), have lower predictive power than PHS and show no evidence for sex differences. Our results indicate revealing sex-dependent genetic architecture requires the consideration of temporal processes of AD. This has strong implications not only for the genetic underpinning of AD but also for how we estimate sex-dependent polygenic effects for clinical use.","Fan, C. C.; Banks, S. J.; Thompson, W. K.; Chen, C.-H.; Mcevoy, L. K.; Tan, C. H.; Kukull, W.; Bennett, D. A.; Farrer, L. A.; Mayeux, R.; Schellenberg, G. D.; Andreassen, O. A.; Desikan, R.; Dale, A. M.",18/04/2019,Genetics,10.1101/613893,1,Chun Chieh Fan,"Center for Human Development, University of California, San Diego",https://www.biorxiv.org/content/10.1101/613893v1?versioned=TRUE,https://www.biorxiv.org/content/10.1101/613893v1.full.pdf,cc_by_nd,NA,
99,70265,B-SIDER: Computational Algorithm for the Design of Complementary ß-sheet Sequences,"The {beta}-sheet is an element of protein secondary structure, and intra-/inter-molecular {beta}-sheet interactions play pivotal roles in biological regulatory processes including scaffolding, transporting, and oligomerization. In nature, a {beta}-sheet formation is tightly regulated because dysregulated {beta}-stacking often leads to severe diseases such as Alzheimers, Parkinsons, systemic amyloidosis, or diabetes. Thus, the identification of intrinsic {beta}-sheet forming propensities can provide valuable insight into protein designs for the development of novel therapeutics. However, structure-based design methods may not be generally applicable to such amyloidogenic peptides mainly owing to high structural plasticity and complexity. Therefore, an alternative design strategy based on complementary sequence information is of significant importance. Herein, we developed a database search method called B-SIDER for the design of complementary {beta}-strands. This method makes use of the structural database information and generates query-specific score matrices. The discriminatory power of the B-SIDER score function was tested on representative amyloidogenic peptide substructures against a sequence-based score matrix (PASTA2.0) and two popular ab initio protein design score functions (Rosetta and FoldX). B-SIDER is able to distinguish wild-type amyloidogenic {beta}-strands as favored interactions in a more consistent manner than other methods. B-SIDER was prospectively applied to the design of complementary {beta}-strands for a splitGFP scaffold. Three variants were identified to have stronger interactions than the original sequence selected through a directed evolution, emitting higher fluorescence intensities. Our results indicate that B-SIDER can be applicable to the design of other {beta}-strands, assisting in the development of therapeutics against disease-related amyloidogenic peptides.","Yu, T.-G.; Kim, H.-S.; Choi, Y.",04/08/2019,Bioinformatics,10.1101/631069,2,Hak-Sung Kim,Korea Advanced Institute of Science and Technology,https://www.biorxiv.org/content/10.1101/631069v2?versioned=TRUE,https://www.biorxiv.org/content/10.1101/631069v2.full.pdf,cc_by,10.1021/acs.jcim.9b00548,
100,70132,Comparative profiling of the synaptic proteome from Alzheimer’s disease patients with focus on the APOE genotype,"Degeneration of synapses in Alzheimers disease (AD) strongly correlates with cognitive decline, and synaptic pathology contributes to disease pathophysiology. We recently discovered that the strongest genetic risk factor for sporadic AD, apolipoprotein E epsilon 4 (APOE4), exacerbates synapse loss and synaptic accumulation of oligomeric amyloid beta in human AD brain. To begin to understand the molecular cascades involved in synapse loss in AD and how this is mediated by APOE, and to generate a resource of knowledge of changes in the synaptic proteome in AD, we conducted a proteomic screen and systematic in-silico analysis of synaptoneurosome preparations from temporal and occipital cortices of human AD and control subjects with known APOE gene status. Our analysis identified over 5,500 proteins in human synaptoneurosomes and highlighted disease, brain region, and APOE-associated changes in multiple molecular pathways including a decreased abundance in AD of proteins important for synaptic and mitochondrial function and an increased abundance of proteins involved in neuroimmune interactions and intracellular signaling.\n\nHighlightsO_LIProteomic analysis of synapses isolated from Alzheimers disease and control subject brains identifies over 5,500 proteins in human synapses.\nC_LIO_LIIn silico analysis reveals region-specific decreases in proteins involved in synaptic and mitochondrial function and increases in proteins involved in neuroimmune signaling and intracellular signaling in AD.\nC_LIO_LIThe apolipoprotein E4 risk gene is associated with exacerbated changes in synaptic proteins in AD.\nC_LI","Hesse, R.; Llavero Hurtado, M.; Jackson, R.; Eaton, S. L.; Hermann, A. G.; Colom Cadena, M.; King, D.; Rose, J.; Tulloch, J.; Mckenzie, C.-A.; Smith, C.; Henstridge, C.; Lamont, D.; Wishart, T.; Spires-Jones, T.",08/05/2019,Neuroscience,10.1101/631556,1,Tara Spires-Jones,The University of Edinburgh,https://www.biorxiv.org/content/10.1101/631556v1?versioned=TRUE,https://www.biorxiv.org/content/10.1101/631556v1.full.pdf,cc_by,10.1186/s40478-019-0847-7,
101,70505,A new clinical tool to predict outcome in early-stage melanoma patients,"Around 25% of early-stage melanoma patients eventually develop metastasis. Thus, we set out to define serological biomarkers that could be used along with clinical and histopathological features of the disease to predict these events. We previously demonstrated that in stage II melanoma patients, serum levels of dermcidin (DCD) were associated with metastatic progression. Based on the relevance of the immune response on the cancer progression and the recent association of DCD with local and systemic immune response against cancer cells, serum DCD was analyzed in a new cohort of patients along with IL-4, IL-6, IL-10, IL-17A, IFN{gamma} TGF{beta} and GM-CSF. We included 448 melanoma patients, 323 of whom were diagnosed as stages I-II according to AJCC. Levels of selected cytokines were determined by ELISA and Luminex and obtained data were analyzed employing Machine Learning and Kaplan-Meier techniques to define an algorithm capable of accurately classifying early-stage melanoma patients with a high and low risk of developing metastasis. The results show that in early-stage melanoma patients, serum levels of the cytokines IL-4, GM-CSF and DCD together with the Breslow thickness are those that best predict melanoma metastasis. Moreover, resulting algorithm represents a new tool to discriminate subjects with good prognosis from those with high risk for a future metastasis.

Novelty and ImpactWe have developed a prognostic equation that considers the serum IL-4, GM-CSF and DCD levels, along with the Breslow thickness to accurately classify melanoma outcome in patients. In this sense, a rigorous follow-up is recommended for early-stage melanoma patients with a high Breslow thickness, high serum IL-4 levels and low GM-CSF and DCD levels at the time of diagnosis, given the elevated risk for these patients to develop metastasis during follow-up.","Mancuso, F.; Lage, S.; Rasero, J.; Diaz-Ramon, J. L.; Apraiz, A.; Perez-Yarza, G.; Ezkurra, P.; Penas, C.; Sanchez-Diez, A.; Garcia-Vazquez, M. D.; Gardeazabal, J.; Izu, R.; Mujika, K.; Cortes, J.; Asumendi, A.; Boyano, M. D.",10/05/2019,Pathology,10.1101/632455,1,Javier Rasero,Biocruces-Bizkaia Health Research Institute,https://www.biorxiv.org/content/10.1101/632455v1?versioned=TRUE,https://www.biorxiv.org/content/10.1101/632455v1.full.pdf,cc_by_nc_nd,NA,
102,70480,"Acute phase protein, a-1-acid glycoprotein (AGP-1), has differential effects on TLR-2 and TLR-4 mediated responses.","Alpha-1-acid glycoprotein (AGP-1) is a major positive acute phase glycoprotein with unknown functions that likely plays a role in inflammation. We tested its involvement in a variety of inflammatory responses using human AGP-1 purified to apparent homogeneity and confirmed its identity by immunoblotting and mass spectrometry. AGP-1 alone upregulated MAPK signaling in murine peritoneal macrophages. However, when given in combination with TLR ligands, AGP-1 selectively augmented MAPK activation induced by ligands of TLR-2 (Braun lipoprotein) but not TLR-4 (lipopolysaccharide). In vivo treatment of AGP-1 in a murine model of sepsis with or without TLR-2 or TLR-4 ligands, selectively potentiated TLR-2-mediated mortality, but was without significant effect on TLR-4-mediated mortality. Furthermore, in vitro, AGP-1 selectively potentiated TLR-2 mediated adhesion of human primary immune cell, neutrophils. Hence, our studies highlight a new role for the acute phase protein AGP-1 in sepsis via its interaction with TLR-2 signaling mechanisms to selectively promote responsiveness to one of the two major gram-negative endotoxins, contributing to the complicated pathobiology of sepsis.","Mosale, S. S.; Abhilasha, K. V.; Jacob, S. P.; Chaithra, V. H.; Basrur, V.; Willard, B.; Mcintyre, T. M.; Prabhu, K. S.; Marathe, G. K.",16/05/2019,Immunology,10.1101/634295,2,Gopal Kedihithlu Marathe,University of Mysore,https://www.biorxiv.org/content/10.1101/634295v2?versioned=TRUE,https://www.biorxiv.org/content/10.1101/634295v2.full.pdf,cc_by_nc_nd,10.1016/j.imbio.2019.06.003,
103,70559,Increasing objective cardiometabolic burden associated with attenuations in the P3b event-related potential component in older adults,"Cardiometabolic diseases and risk factors increase the risk of late-life cognitive impairment and dementia, and have also been associated with detrimental grey and white matter changes. However the functional brain changes associated with cardiometabolic health in late-life are unclear. We sought to characterise these functional changes by recording event-related potentials (ERPs) during a n-back working memory task (0, 1 and 2 back) in 85 adults (60% female) between 50 and 80 years of age. Due to a stratified recruitment approach, participants varied widely regarding cognitive function and cardiometabolic health. Standard and objective cut-offs for high blood glucose, waist to hip ratio (i.e. obesity), high blood cholesterol, and hypertension were employed to generate a summative score for cardiometabolic burden (none, one, or two or more above cut-off). Mixed effects modelling (covarying for age and gender) revealed no statistically significant associations between cardiometabolic burden and visual P1 and N1 component amplitudes. There was a significant effect for the P3b component: as cardiometabolic burden increased, P3b amplitude decreased. We show that cardiometabolic factors related to the development of cognitive impairment and dementia in late-life associate with functional brain activity, as recorded via ERPs. Findings have relevance for the monitoring of lifestyle interventions (typically targeting cardiometabolic factors) in ageing, as ERPs may provide a more sensitive measure of change than cognitive performance. Further, our results raise questions related to the findings of a broad range of ERP studies where the groups compared may differ in their cardiometabolic health status (not only in psychological symptomatology).","Keage, H.; Feurriegel, D.; Greaves, D.; Tregoweth, E.; Coussens, S.; Smith, A.",12/05/2019,Neuroscience,10.1101/634873,1,Hannah Keage,University of South Australia,https://www.biorxiv.org/content/10.1101/634873v1?versioned=TRUE,https://www.biorxiv.org/content/10.1101/634873v1.full.pdf,cc_no,10.3389/fneur.2020.00643,
