Cohort,Reason
BRACE,"Memory complaint cohort unlikely to be dementia free at baseline"
MEMENTO,"Memory complaint cohort unlikely to be dementia free at baseline"
ELSA,"Lipid exposure reported as a binary variable ("ever high cholesterol")""
Generation Scotland,"Cross-sectional - only one wave of data available"
NICOLA,"Cross-sectional - only one wave of data available"
TRACK HD,"Participants carried HTT gene (i.e. premanifest Huntington's Disease). Cohort owners indicated that this is likely to overshadw"